feature,original,summary,reference
"The original label ""average_cationic_radius_0"" without the integer becomes ""average_cationic_radius."" A more human-interpretable version of this label could be ""Average Cationic Radius.""","with ABX 3composition (A and B cations, X anion), which has
proven able to predict whether or not a cubic perovskite crystal
structure will form, and has recently been successfully extended
and adapted towards hybrid organic–inorganic perovskites.17–20
Furthermore it has been observed and calculated that not only
charge but also ionic radius (mis)matching determine the pre-
ferred dopant lattice site and association to intrinsic (charge
compensating) defects in inorganic crystals, e.g. BaTiO 3.21,22
Similarly, one may expect that large differences in ionic radius
may hamper uniform mixing of cations in the SBUs of MOFs and
ionic size- and coordination number-related arguments have
been invoked to explain why certain ions are more easily
accommodated in the SBUs of a MOF structure than others.23
In an excellent review, Cheetham et al.24explained that metal–
organic frameworks should be considered as thermodynamic
meta-stable states, as crystal chemistry thermodynamics favor","The text discusses the prediction of cubic perovskite crystal structures with ABX\(_3\) composition, focusing on the roles of cation and anion selection. It highlights the extension of these predictions to hybrid organic–inorganic perovskites. The text also notes that both charge and ionic radius mismatches influence the preferred dopant lattice sites and their association with intrinsic defects in inorganic crystals, such as BaTiO\(_3\). It suggests that significant differences in ionic radii may hinder the uniform mixing of cations in the secondary building units (SBUs) of metal-organic frameworks (MOFs). Ionic size and coordination number are important factors in determining which ions are more easily incorporated into MOF structures. Cheetham et al. have reviewed that MOFs should be viewed as thermodynamic meta-stable states, as crystal chemistry thermodynamics are influential.","REFERENCE:(Sara Abednatanzi, Parviz Gohari Derakhshandeh, Hannes Depauw, François-Xavier Coudert, Henk Vrielinck, Pascal Van Der Voort, Karen Leus,2019,Mixed-metal metal–organic frameworks)"
