feature,original,summary,reference
New label: Is a carbon-oxygen single bond.,"8
Vol:.(1234567890) Scientific Reports  |         (2023) 13:4908  | https://doi.org/10.1038/s41598-023-31169-8
www.nature.com/scientificreports/most common was just a carbon fragment, perhaps due to the abundance of this substructure in the Morgan 
fingerprints. Substructures with oxygen were also common, either as a carbonyl (Tox21 and RTECS), ketone 
(Tox21), or as an ether (RTECS). Different portions of aromatic rings were identified multiple times, within an 
aryl ring (Tox21 and RTECS), or within a benzyl group (Tox21 and RTECS). Finally, N was obtained for both 
Tox21 and RTECS. Thus, the presence of nucleophilic N, O, and aryl containing substructures was commonly 
identified as explanations for in vitro and in vivo predictions of toxicity.
Explanations of “toxic” predictions obtained from the absence of PN substructures from molecules predicted 
to be toxic, most commonly contained carbon fragments and substructures with N and O for both Tox21 and","The study analyzed the common substructures associated with toxicity predictions in chemical compounds using Morgan fingerprints. Carbon fragments were the most frequently observed substructures, likely due to their prevalence in the fingerprints. Oxygen-containing substructures, such as carbonyls, ketones, and ethers, were also common. Aromatic rings, including aryl and benzyl groups, were identified multiple times. Nitrogen-containing substructures were noted for both Tox21 and RTECS datasets. The presence of nucleophilic nitrogen, oxygen, and aryl substructures was linked to in vitro and in vivo toxicity predictions. Additionally, the absence of phosphorus-nitrogen (PN) substructures in molecules predicted to be toxic often included carbon fragments and substructures with nitrogen and oxygen.","REFERENCE:(Bhanushee Sharma, Vijil Chenthamarakshan, Amit Dhurandhar, Shiranee Pereira, James A. Hendler, Jonathan S. Dordick, Payel Das,2023,Accurate clinical toxicity prediction using multi‑task deep neural nets and contrastive molecular explanations)"
New label: Is a carbon-oxygen single bond.,"canonical SMILES, encoding for the relationship between chemicals within the datasets.
With these molecular representations, toxicities in vivo, in vitro, and clinical, were predicted through multi-
task (MTDNN) (Fig.  1B) and single-task Deep Neural Networks (STDNN) (Fig.  1B). The MTDNN predicts each 
platform (in vivo, in vitro, clinical) as a different task within one model, with each task consisting of a single or 
multiple classes (or endpoints). In contrast, the STDNN predicts each platform with a separate model.
As a proof-of-concept, endpoints from previous benchmarking  efforts45 and data  challenges16 were chosen, 
and are not exhaustive. For the clinical platform, the endpoint was whether or not a molecule failed clinical phase 
trials due to toxicity, as obtained from the ClinTox  dataset45. For the in vitro platform, 12 different endpoints from 
the Tox21  Challenge16 were used, whether or not a molecule is active in disrupting seven neural receptor assays","The text discusses the use of canonical SMILES for encoding chemical relationships in datasets and the prediction of toxicities using deep neural networks. Two types of models are employed: Multi-Task Deep Neural Networks (MTDNN) and Single-Task Deep Neural Networks (STDNN). MTDNN handles predictions for in vivo, in vitro, and clinical platforms as separate tasks within a single model, while STDNN uses separate models for each platform. As a proof-of-concept, endpoints from previous benchmarking efforts and data challenges were selected. For the clinical platform, the endpoint was the failure of a molecule in clinical trials due to toxicity, based on the ClinTox dataset. For the in vitro platform, 12 endpoints from the Tox21 Challenge were used, focusing on the activity of molecules in disrupting seven neural receptor assays.","REFERENCE:(Bhanushee Sharma, Vijil Chenthamarakshan, Amit Dhurandhar, Shiranee Pereira, James A. Hendler, Jonathan S. Dordick, Payel Das,2023,Accurate clinical toxicity prediction using multi‑task deep neural nets and contrastive molecular explanations)"
New label: Is a carbon-oxygen single bond.,"4.0; U.S. Environmental Protection Agency: Washington, DC, USA, 2018.
104. Schmidt, U.; Struck, S.; Gruening, B.; Hossbach, J.; Jaeger, I.S.; Parol, R.; Lindequist, U.; Teuscher, E.;
Preissner, R. SuperToxic: A comprehensive database of toxic compounds. Nucleic Acids Res 2009 ,37,
D295–D299. [CrossRef] [PubMed]
105. Attene-Ramos, M.S.; Miller, N.; Huang, R.; Michael, S.; Itkin, M.; Kavlock, R.J.; Austin, C.P .; Shinn, P .;
Simeonov, A.; Tice, R.R. The Tox21 robotic platform for the assessment of environmental chemicals—From
vision to reality. Drug Discov. Today 2013 ,18, 716–723. [CrossRef] [PubMed]
106. Hansch, C. Quantitative approach to biochemical structure-activity relationships. Acc. Chem. Res. 1969 ,2,
232–239. [CrossRef]
107. Bradbury, S.P . Predicting modes of toxic action from chemical structure: An overview. SAR QSAR Environ. Res.
1994 ,2, 89–104. [CrossRef] [PubMed]","The provided text is a list of references from a journal article. It includes citations for various studies and resources related to toxicology and chemical assessment. Key references include:

1. The U.S. Environmental Protection Agency's 2018 publication.
2. Schmidt et al.'s 2009 paper on SuperToxic, a comprehensive database of toxic compounds, published in Nucleic Acids Research.
3. Attene-Ramos et al.'s 2013 article on the Tox21 robotic platform for assessing environmental chemicals, published in Drug Discovery Today.
4. Hansch's 1969 work on quantitative approaches to biochemical structure-activity relationships, published in Accounts of Chemical Research.
5. Bradbury's 1994 overview on predicting modes of toxic action from chemical structure, published in SAR QSAR Environmental Research.","REFERENCE:(Yunyi Wu, Guanyu Wang,2018,Machine Learning Based Toxicity Prediction: From Chemical Structural Description to Transcriptome Analysis)"
New label: Is a carbon-oxygen single bond.,"•  The dose is an issue, or more properly the issue, 
a concept that can be traced to Paracelsus.
•  Covalent binding can be an index of toxicity, but 
exceptions exist even after considerations of dose. Other issues (in addition to covalent binding) are receptor-mediated events (especially signalling), ability to repair DNA and protein damage, cell proliferation and immune responses.
412 | MAY 2005 | VOLUME 4  www.nature.com/reviews/drugdiscREVIEWS","The text discusses the concept of dose as a critical factor in toxicity, a principle originating from Paracelsus. While covalent binding is often used as an indicator of toxicity, there are exceptions even when dose is considered. Other important factors influencing toxicity include receptor-mediated events, DNA and protein repair capabilities, cell proliferation, and immune responses.","REFERENCE:(Daniel C. Liebler, F. Peter Guengerich,2005,ELUCIDATING MECHANISMS OF DRUGINDUCED TOXICITY)"
New label: Is a carbon-oxygen single bond.,"concept) or even toxic.
1
The important role of metabolism in the toxicity of small
organic molecules highlights the need for the consideration of
metabolic pathways also in the computational prediction of
toxicity. However, so far only a few in silico models for toxicity
prediction have integrated metabolism information. Forexample, Dmitriev et al.
2built linear models for the prediction
of rat acute toxicity using self-consistent regression, therebyconsidering parent compounds and measured metabolites.More speci cally, they trained a model on about 3000 parent
compounds and used it to predict the LD
50value of 37 test
parent compounds and their measured metabolites (around
200 known metabolites). To calculate the nal LD 50value,
diﬀerent strategies for averaging the LD 50values predicted for","The text discusses the significance of considering metabolic pathways in the computational prediction of the toxicity of small organic molecules. It notes that only a few in silico models have incorporated metabolism information into toxicity predictions. An example provided is the work by Dmitriev et al., who developed linear models using self-consistent regression to predict rat acute toxicity. They trained their model on approximately 3,000 parent compounds and used it to predict the LD50 values of 37 test parent compounds and their measured metabolites, which included around 200 known metabolites. Different strategies were employed to average the predicted LD50 values.","REFERENCE:(Marina Garcia de Lomana, Fredrik Svensson, Andrea Volkamer, Miriam Mathea, Johannes Kirchmair,2022,Consideration of predicted small-molecule metabolites in computational toxicology)"
